{"generation":4,"manifest_hash":"cba277b591f0a6e7aeae12dc3b14d575337bdae39a5983bd85ff9eef1acaad6f","namespace_id":"hmk:daimon-namespace:v1:0NTrertv2XdmcqsnmrpqYda-_HM0raLu3xJDLpgYfFo","outcome":"rebuilt","plan_hash":"27018ece8b153c181aa023a317f194eda7ed16361e9612edafe389ab43207a19","plan_id":"hmk:daimon-rebuild-plan:v1:jekCr1sMsPJpBkw0HPyGq4RB0hKyjjhXMfpQT-C5tww","projection_ids":["hmk:daimon-projection:v1:XvYnUQwZQNy5kEh1Mq-XoiIcQLvMY8NcrVj9kE7jrK8","hmk:daimon-projection:v1:gpYNV0-bajMTu1mPQfNOAGQI0KjO26gXwKOYETT_vAw"],"receipt_id":"hmk:daimon-rebuild-receipt:v1:wODJZMzVrt79qVapphyTnsPAxELIjjQPjd73hwxmllQ","schema":"hmk.daimon-projection.rebuild-receipt/v1","source_checkpoint":{"hash":"03d91bd4a38c5d1fd628865a18feb50cfc1b9a244893ffac2c997c3cc2ca220a","sequence":10},"target":{"api_version":"1.0.0","instance_id":"hmk:vector-instance","schema_version":1}}
